[
  {
    "id": "4593761e-8a5d-4564-8c0e-2126fb4f3338",
    "title": "[TEST] Migrated Content 1",
    "alias": "/test/migrated-content-1",
    "summary": "Summary for [TEST] Migrated Content 1",
    "topics": "[TEST] Topic 1,[TEST] Topic 2,[TEST] Topic 3,[TEST] Topic 4",
    "thumbnail": ["f352fb5f-5319-4a09-a039-6b7080b31443"],
    "vertical_spacing": "top",
    "hide_sidebar": true,
    "show_last_updated_date": true,
    "last_updated_date": "8 Oct 2022",
    "show_toc": true,
    "banner": {
      "type": "container",
      "children" : [
        {
          "theme": "dark",
          "title": "[TEST] Banner title - Migrated Content 1",
          "banner_type": "large",
          "blend_mode": "darken",
          "featured_image": [
            "7bed7c3c-ebab-44aa-b19e-0e164ab81d10"
          ],
          "background": [
            "427186ad-c561-4441-9951-28399d8a4923"
          ],
          "hide_breadcrumb": true
        }
      ]
    }
  }
]
